{
  "id": "workflow-my-workflow",
  "title": "My Workflow",
  "description": "An automated pipeline that chains multiple steps.",
  "version": "1.0.0",
  "author": "your-github-username",
  "category": "workflows",
  "tags": ["ci-cd", "automation"],
  "pricing_model": "free",
  "license": "Apache-2.0",
  "repository": "https://github.com/your-username/your-workflow-repo",
  "min_prowlrbot_version": "0.1.0",
  "steps": ["step-one", "step-two"],
  "triggers": ["manual"]
}
